{
  "id": "01929a10-0000-7000-8000-000000000002",
  "type": "device.claimed",
  "at": "2026-10-23T09:05:00Z",
  "manufacturer_id": "01928f00-0000-7000-8000-00000000acde",
  "data": {
    "did": "acme-P2A1B2C3D4",
    "hw_type_id": "01928f3e-5a7b-7c00-8d00-0000000000a1",
    "method": "ble",
    "fw": "1.4.2",
    "country": "UA"
  }
}
